{
  "schema_version": 1,
  "semantic_version": "0.158.0",
  "status": "reported",
  "updated_at": "2026-09-28T05:07:23Z",
  "artifacts": {
    "snapshots_dir": "snapshots/0.158.0",
    "reports_dir": "reports/0.158.0",
    "union_complete": true
  },
  "coverage": {
    "supported_targets": [],
    "supported_required_target": false
  },
  "promotion": {
    "eligible_for_latest_validated": false
  }
}
