{
  "schema_version": 1,
  "semantic_version": "0.129.0",
  "status": "reported",
  "updated_at": "2026-05-14T23:09:56.23198Z",
  "artifacts": {
    "snapshots_dir": "snapshots/0.129.0",
    "reports_dir": "reports/0.129.0",
    "union_complete": false
  },
  "coverage": {
    "supported_targets": [
      "x86_64-unknown-linux-musl"
    ],
    "supported_required_target": true
  },
  "promotion": {
    "eligible_for_latest_validated": false
  }
}
